{
 "objectives": {
  "focus": "knowledge",
  "knowledge": "로봇의 세 장치(감지·제어·구동)가 하는 일을 알고 친구에게 설명할 수 있다",
  "skill": "청소 로봇의 움직임을 세 장치가 하는 일로 나누어 활동지에 나타낼 수 있다",
  "attitude": "생활 속 로봇이 주는 도움을 찾아보며 친구와 나누려고 노력할 수 있다"
 },
 "evidence": [
  {
   "domain": "knowledge",
   "type": "고르기",
   "how": "생각 점검 문항에 답하기"
  },
  {
   "domain": "skill",
   "type": "쓰기",
   "how": "활동지 표에 청소 로봇 장치별 하는 일 쓰기"
  },
  {
   "domain": "attitude",
   "type": "말하기",
   "how": "생활 속 로봇 한 가지를 골라 짝에게 소개하기"
  }
 ],
 "success_criteria": [
  {
   "domain": "knowledge",
   "student": "나는 로봇의 세 장치가 하는 일을 설명할 수 있어요",
   "not_yet": "사람 몸 비유 카드를 보며 하나씩 짚어 말해 봐요"
  },
  {
   "domain": "skill",
   "student": "나는 청소 로봇의 움직임을 세 장치로 나누어 쓸 수 있어요",
   "not_yet": "'알아차리기 → 정하기 → 움직이기' 순서로 한 칸씩 채워 봐요"
  },
  {
   "domain": "attitude",
   "student": "나는 생활 속 로봇이 주는 도움을 친구와 나눌 수 있어요",
   "not_yet": "집이나 학교에서 본 기계 하나를 떠올려 봐요"
  }
 ],
 "growth_levels": {
  "knowledge": {
   "deepening": "세 장치를 처음 보는 로봇에도 적용해 설명함. 장치끼리 정보가 오가는 순서를 덧붙이면 더 넓어질 수 있음",
   "achieving": "세 장치의 이름과 하는 일을 설명함. 사람 몸 비유를 함께 말하면 더 깊어질 수 있음",
   "starting": "세 장치 이름 일부를 기억해 가고 있음. 비유 카드를 보면 설명에 다가갈 수 있음"
  },
  "skill": {
   "deepening": "청소 로봇의 흐름을 화살표로 이어 쓰고 다른 로봇에도 적용함",
   "achieving": "장치별 하는 일을 각각 씀. 순서를 화살표로 이으면 더 깊어질 수 있음",
   "starting": "한두 칸을 채우고 있음. 예시 답안을 나란히 보면 나머지도 해낼 수 있음"
  },
  "attitude": {
   "deepening": "로봇의 도움과 걱정되는 점을 함께 생각해 나눔. 다른 사람의 입장까지 생각하면 더 넓어질 수 있음",
   "achieving": "생활 속 로봇의 도움을 한 가지 나눔. 걱정되는 점도 함께 말하면 더 깊어질 수 있음",
   "starting": "친구의 이야기를 들으며 관심을 넓혀 가고 있음. 집에서 본 기계 하나를 떠올려 말해 보면 나눔에 다가갈 수 있음"
  }
 },
 "checks": {
  "intro": {
   "question": "집이나 식당에서 스스로 움직이는 기계를 본 적이 있나요?",
   "purpose": "생활 경험 떠올리기"
  },
  "hinge": {
   "heading": "생각 점검",
   "page": "11",
   "question": "청소 로봇이 벽을 만나 <b>방향을 바꾸자</b>고 정하는 곳은 어디일까요?",
   "explain": "정보를 받아 판단하고 명령하는 곳은 제어 장치예요.",
   "options": [
    {
     "text": "제어 장치",
     "correct": true
    },
    {
     "text": "감지 장치",
     "misconception": "알아차리는 일과 정하는 일을 같은 일로 보는 중",
     "teacher_move": "눈은 보기만 하고 정하는 것은 두뇌라는 비유를 나란히 보여 주면 구별할 수 있습니다."
    },
    {
     "text": "구동 장치",
     "misconception": "바퀴가 스스로 방향을 정한다고 보는 중",
     "teacher_move": "바퀴는 명령을 받아 움직인다는 것을 순서(감지→제어→구동)로 다시 짚어 주면 나아갈 수 있습니다."
    }
   ]
  },
  "exit": {
   "question": "로봇의 세 장치 이름을 쓰고, 사람 몸의 어디와 닮았는지 이어 보세요.",
   "domain": "knowledge"
  }
 },
 "self_check": [
  "나는 세 장치의 이름과 하는 일을 말해 보았어요",
  "나는 청소 로봇의 움직임을 순서대로 써 보았어요",
  "나는 친구의 생각을 끝까지 들었어요"
 ]
}